transcriptionid	videoid	phrases_both	phrases_caption	phrases_video
9a443634-7f2e-4d3a-9ccd-0f1b6604c939	5d5ac9e4-567b-4ce1-a1b2-b4dd5197013c	syntagmatic relation, text retrieval, total number, general idea, relation discovery, paradigmatic relation	common words, word distribution, paradigmatic relations, syntagmatic relations, similarity function, scoring function	pseudo document, idea text, doc w, retrieval model, wi count, corresponding context document, text retrieval model, similar word, art syntagmatic relation, popular term, word w, idf weighting, general idea text, context vector, corresponding context, word pair, randomly pick word, word wi, two context, candidate word, paradigmatic relation discovery, highly similar word, highly weight term, idea text retrieval, similar word pair, two candidate word, two context document, different way, two candidate, total count, context document
6a9537c1-62fc-4f31-a8a7-bdfcad2f50eb	e212734f-6e3e-4124-ac91-f21ab1e126a1	topic model, text mining, word distribution, generative model, topic mining, probabilistic topic	data point, observed data, word distributions, special case, general idea, high probabilities, topic models, topic coverage, data mining, multiple topics, parameter values, world distribution, related words	world text datum, model datum generation, likely parameter, vocabulary coverage, text datum, word sense ambiguity, multiple word, flight play star, datum generation, mining problem, model datum, text document, data generation, subtle semantic variation, star genetic, sense ambiguity, genetic set, flight play, probabilistic topic mining, different knowledge, complicated topic, basketball star, real world, topic — weight, star genetic set, general topic, world text, collection c, play star genetic, computation task, probabilistic topic model, vocabulary set, perceive express, semantic variation, likely parameter value, expressive power, particular datum, power topic, text mining problem, output topic, parameter value, expressive power topic, play star, world observe world, analysis input, word sense
54ab232c-85cb-4829-abd0-6cbaed5f3fc8	ce34689a-3b10-4b2d-83e1-e79b589b9582	language model, word distribution, topic model, probabilistic topic	data point, unigram language, text mining, observed data, word distributions, generative model, total number, likelihood estimate, special case, maximum likelihood, maximum likelihood estimate, language models, topic models	probability distribution, language processing representation, probabilistic mechanism, lm mining paper, model part, sentiment analysis, statistical language model, lm mining, association sentiment, unigram lm mining, word association sentiment, word sequence, opinion mining, unigram lm, language processing, probabilistic topic model, topic mining, word association, association sentiment analysis, statistical language, simple language, processing representation, simple language model, language model part, mining paper
48b37a2f-5ca3-4b7b-9bfc-d841da37c566	9b1fc643-c08f-43ea-a801-ed76727f4c45	likelihood function, bayes rule, unigram language, language model, word distribution, generative model, maximum likelihood, topic mining	data point, conditional probability, posterior probability, text mining, observed data, likelihood estimator, likelihood estimate, special case, high probabilities, maximum likelihood estimate, bayesian inference, maximum likelihood estimator, parameter values, prior knowledge	probability distribution, maximum likelihood estimation, word distribution likelihood, datum likelihood, text datum, text datum unigram, max max, max problem, likelihood estimation, statistical language model, summary language, unigram language model, distribution likelihood function, bayesian estimation, high likelihood, summary language model, posterior distribution, datum unigram, statistical language, datum unigram language, ml estimate, max max problem, distribution likelihood
e6c92e3a-0169-4af1-96d7-3fe4a5303e3a	c1d82277-97a2-4db4-bb6a-a33df2745bd5	text mining, likelihood estimate, maximum likelihood, maximum likelihood estimate, topic model, probabilistic topic	likelihood function, data point, common words, unigram language, likelihood estimator, optimization problem, word distribution, language model, generative model, probabilistic models, maximum likelihood estimator, objective function, topic models	text datum, one topic, text representation, sentiment analysis, log - likelihood, mining paper mining, natural language text, q | mining, language text, simple case, opinion mining, mining one topic, natural language, probabilistic topic model, paper mining, docd text, topic mining, text mining paper, docd text datum, language text representation, mining paper
8eaf2971-31ff-40b7-9fc6-b91c7637f916	9e7e8290-40d0-41a5-a3a5-09c69371fbf4	unigram language, topic model, mixture model, word distribution, language model, generative model, probabilistic topic	data point, likelihood function, common words, likelihood estimator, topic word, likelihood estimate, word distributions, high probabilities, background words, special case, maximum likelihood, maximum likelihood estimate, maximum likelihood estimator, language models, topic models	background topic, text mining paper, I choice food, two word, text mining, background word, parameter two unigram, unigram lm, common word, unigram language model, two unigram language, probabilistic topic model, two word distribution, two unigram, topic choice, two unigram lm, mining paper
27d06808-2624-4922-a079-04dccb301dde	78873d30-24f0-456d-af04-2935c3ecf451	mixture model, topic model, probabilistic topic	likelihood function, common words, observed data, likelihood estimator, word distribution, topic word, background words, special case, high probabilities, topic models, maximum likelihood, maximum likelihood estimator, objective function, world distribution, background model	mixture model estimation, sentiment mining, word sentiment, opinion mining, model estimation, one topic, language processing, probabilistic topic model, word sentiment mining, topic mining, topic choice
5350ccd0-beab-48fc-8484-d8e6a38c4cbf	bd76c12f-bd57-4677-8aa1-50b46227d456	mixture model	likelihood function, data point, likelihood estimator, word distribution, language model, background words, special case, high probabilities, maximum likelihood, maximum likelihood estimator, background language, objective function, background language model, background model	mixture model estimation, topic model, model estimation part, estimation part, datum frequency, model estimation, probabilistic topic model, high frequency word, probabilistic topic, frequency word
93efd70b-16b1-45f1-9c81-c0f2aeb7c9ee	4b1fb2d3-4f9b-4850-a355-c2ea0ef0344a	topic model, probabilistic topic	bayes rule, mixture model, word distribution, likelihood estimate, topic word, background words, topic models, maximum likelihood, bayesian inference, maximum likelihood estimate, parameter values, world distribution, background model	algorithm part, opinion mining, language processing, maximization algorithm part, probabilistic topic model, topic mining, topic choice, word association, expectation - maximization, text representation, maximization algorithm
4c3d9363-8e43-44fe-ab21-8740cfd1a8c5	cbf1da89-1466-4d25-b81c-6d345e9b88c7		likelihood function, bayes rule, common words, text mining, word distribution, word distributions, topic word, background words, high probabilities, general idea, parameter values, world distribution, background model	e - step, topic model, random value, likelihood change, probabilistic topic model, paper 1 present, e - ste, expectation - maximization, probabilistic topic, maximization algorithm
1cc2d7fa-3d11-49fa-b979-ef5e9442466f	882df9df-e834-4d22-811e-9eb9fdcd33f0		likelihood function, likelihood estimator, mixture model, word distribution, language model, word distributions, background words, optimization problem, topic models, maximum likelihood, topic coverage, multiple topics, maximum likelihood estimator, background language, background language model, topic model, background model	probabilistic latent, unknown parameter, latent semantic analysis, analysis mining, multiple topic, ml parameter estimation, great new relief, parameter estimation, text representation, new orleans, sentiment analysis, government response, million resident, seventy help, association sentiment, mixed topic, blog article, word association sentiment, semantic analysis, opinion mining, natural language, topic mining, word association, sentiment analysis mining, metropolitan area, background coverage, ml parameter, association sentiment analysis, delayed response, monetary donation, mining multiple topic, op new, new relief
4453a049-7597-4df4-9b9b-67c2d124a116	a02d0ea0-2235-47f9-8562-974151c70692	mixture model	bayes rule, unigram language, likelihood estimator, language model, word distribution, word distributions, maximum likelihood, maximum likelihood estimator, background language, background language model, language models	associate topic, topic ml, em algorithm, topic time location, determined background, topic indicator, topic time, probabilistic latent, unknown parameter, text datum, latent semantic analysis, application ! clustering, determined background lm, semantic analysis, discriminative topic, associate topic time, topical knowledge, discriminative topic ml, time location, background lm
5190e288-54f7-4021-9083-8e8ceac11345	2663cf62-2f01-429f-8c0c-ea777cb56d9f	prior knowledge	likelihood estimator, language model, word distributions, word distribution, generative model, high probabilities, maximum likelihood, topic coverage, bayesian inference, information retrieval, maximum likelihood estimator, background language, background language model, topic model, world distribution, topic models	em algorithm, high probability, laptop user, latent dirichlet allocation, particular word, ml estimate, retrieval model, map estimate, dirichlet allocation, particular doc, latent dirichlet, prior preference, similar em algorithm
d857a66b-1018-4ffb-821a-9d8acc6f5012	5c0df7ef-8040-4233-8b18-0c91ca645094	likelihood function, text mining, word distribution, generative model, topic model, probabilistic topic	likelihood estimator, mixture model, word distributions, likelihood estimate, topic word, topic models, maximum likelihood, topic coverage, bayesian inference, maximum likelihood estimate, maximum likelihood estimator, training data, background model	application basic task, inference method, latent dirichlet allocation, text datum, inference different inference, application lda, multinomial topic model, n’t compute probability, approximate inference, topic choice, parameter estimation, lda parameter, basic task setup, different inference method, different inference, high complexity, qiaozhu mei, new document, model local maxima, local maxima, general principle way, dirichlet allocation, arg max, core assumption, lda core, xuehua shen, posterior inference, task performance, acm kdd, empirical study, probabilistic topic model, arg max log, latent dirichlet, lda core assumption, plsa lda, max log, basic topic model, automatic labeling, basic topic, yue lu, task setup, ml estimator, multinomial topic, heuristic workaround, basic task
8717e27a-33fb-4d06-ae68-2e0d915b1568	1ad61df9-ce18-467d-927b-a0da2cff7ca7	mixture model, document clustering, text clustering, topic mining, topic model	likelihood function, data point, word distribution, word distributions, generative model, special case, probabilistic models, topic coverage, multiple topics, generative models, world distribution, topic models	mode output, document input, text datum, probabilistic model, clustering result, one topic, generative mode output, generative probabilistic model, generative mode
f64adab4-578a-4868-8b2c-03fdd4ddf55d	923f6adf-9d96-439e-b5ca-ee43cb81f4a9	likelihood function, mixture model, text clustering	posterior probability, unigram language, likelihood estimator, language model, word distribution, word distributions, document clustering, probabilistic models, maximum likelihood, maximum likelihood estimator, topic model, language models	cluster allocation, association mining, word association mining, probabilistic model, large cluster, language processing, word association, generative probabilistic model, parameter estimation, text representation
dccc8a84-66da-47ce-ab88-28e8acf192b9	7e7ea099-d2b7-44fb-8d38-2a05ce7657c6	maximum likelihood, document clustering, text clustering	likelihood function, bayes rule, posterior probability, unigram language, likelihood estimator, mixture model, word distribution, language model, probabilistic models, maximum likelihood estimator, topic model, language models, topic models	variable z, sentiment analysis, e - step, language text, likelihood converge, randomly set repeat, word sentiment, opinion mining, probabilistic model, ml estimate, unigram lm, likelihood estimate, word sentiment analysis, dy } model, maximum likelihood estimate, generative probabilistic model
6962b043-7dd8-4050-bad0-bbdb13e2c302	c00450ef-9290-41db-a40d-b648226369b4	text categorization, document clustering	background language, bayes rule, common words, word distribution, topic word, categorization problem, generative models, text clustering, training data, naive bayes, conditional probability, posterior probability, mixture model, word distributions, generative model, high probabilities, scoring function, prior knowledge, unigram language, likelihood estimator, language model, probabilistic models, multiple topics, background language model, machine learning, special case, maximum likelihood, logistical regression, maximum likelihood estimator, logistic regression, language models, background model	naive baye, baye classifier, two category, probabilistic model, generative probabilistic model, naive baye classifier
ee41ce3a-6c8d-4c3b-90fd-79f3e9190402	e2bd5a88-004f-42e6-adef-41306c6b549e	sentiment analysis, opinion mining, generative model, aspect rating, text categorization	text mining, word distribution, word distributions, aspect ratings, opinion holder, language processing, generative models, topic model, overall ratings	expensive hotel, preference weight, three night stay, latent rating, like expensive hotel, morgan & publishers, information retrieval, behavior analysis, business center, product sound bud, pretty much connect, rating regression, view restaurant, hotel max, daily charge, service format volume, rating behavior analysis, volume video, specific sentiment, different aspect, review text, acm kdd, review opinion, price hotel, detailed opinion, review rating, bud customer amazon, reasonable price hotel, value location, product sound, opinion morgan, rating decomposition, text datum, price hotel max, mp3 review rating, latent aspect, sample result, text categorization technique, short walk, bud customer, like cheap hotel, latent aspect rating, review text datum, place market, website dingy, sentiment foundation, night stay, disappointing part, format volume video, user rating behavior, value location view, different aspect rating, low val, product review, sound bud, user preference, much connect, rating behavior, life accessory service, rating regression proceeding, three night, lillian lee, different reviewer, yue lu, accessory service format, categorization technique, good value, product review opinion, value aspect, consumer preference, user rating, category generative model, mining latent, recent three night, service format, social medium, unified generative model, pike place market, review opinion mining, topical aspect, format volume, enriched feature representation, ground - truth, sentimental information, aspect keyword, player product sound, analysis without aspect, top-10 amsterdam, mining latent user, without aspect keyword, location view, high val, excellent choice, unique character, specific sentiment lexicon, aspect summarization, customer amazon, reasonable price, latent user preference, latent user, mp3 review, application ! sentiment, player product, good service, reviewer ’ rating, location view restaurant, table topical aspect, battery life, great location, value room, overall rating, enriched feature, cheap hotel, accessory service, pike place, life accessory, regression proceeding, aspect level, opinion reviewer, entity review, battery life accessory, rating analysis, feature representation, sentiment lexicon, without aspect, aspect rating analysis, sound bud customer, star hotel
3103be2f-681e-41cf-b0f7-21cf6ba56616	eae40e76-7192-4e5d-ae70-e2e83a1f3f6c	contextual text, text mining, generative model, topic coverage, contextual text mining	conditional probability, language model, word distributions, word distribution, text retrieval, probabilistic models, multiple topics, information retrieval, world distribution	paper & ponte, bei yu, spatiotemporal theme pattern, cluster cluster, life cycle, topic extension, probabilistic latent, theme life, event impact analysis, acm sigkdd, theme pattern mining, enable discovery, parameter estimation, text give context, government response, em algorithm, sentiment mining, theme weapon, discovery datum, mixture model, knowledge discovery datum, models igir paper, discovery datum mining, generation process, common theme, igir paper, blog article, interesting context variable, opinion mining, semantic analysis, chao liu, language processing, discovery contextualize topic, specific theme, world wide web, topic mining, acm sigkdd conference, dependent view, different role, context assume, weapon 0015 theme, comparative text mining, content variation, new york, context influence, hang su, models igir, topic assume, kdd acm, interesting context, time 2005 location, context variable, theme pattern, latent semantic analysis, naturally contain context, afghan war, contextual probabilistic latent, event impact, coverage em algorithm, hurricane katrina, topic assume context, model enable discovery, dependent topic, atulya velivelli, assume context, qiaozhu mei, comparative text, wide web, sigkdd conference, spatial distribution, cluster 2 cluster, context assume context, two war, natural language, conditional likelihood, knowledge discovery, international conference, dependent topic coverage, natural language processing, spatiotemporal theme, ir research, document time, retrieval models igir, datum mining, pattern mining, theme life cycle, cluster 3 theme, retrieval models, impact analysis
aca8d826-412b-4134-8d2c-87537fdc4a76	48c298af-6f56-4518-ba92-4af1d2da799b	text mining	sentiment analysis, opinion mining, word associations, language processing, data mining, topic mining	world text datum, text datum express, datum observe world, datum express, text datum, world text, real - world, overview text mining, predictive analytic, real world, overview text
db1d54dd-bb05-46c0-995b-5f7d5243e3c4	608d3900-6494-4bf0-97d9-0a0853f4ffb5		sentiment analysis, machine learning, text mining, language processing, related words	text representation, pos tag
2997c717-2552-411d-9dc4-7e648e16bbf0	a38f9e2a-e3db-4b29-9070-56d88bd45465	sentiment analysis	text mining, text object, language processing, text objects, related words	stylistic analysis, knowledge assistant, string processing, network analysis, knowledge graph analysis, text representation, logic inference, graph analysis, little manual effort, mining algorithm, word word, topic thesaurus discovery, information network analysis, feature extraction, entity - relation, word word relation, relation analysis, relation graph, word topic thesaurus, analysis stylistic analysis, extraction & knowledge, real application, predicate knowledge, syntactic graph analysis, specific entity, network analysis opinion, syntactic graph, relation information network, word relation analysis, multiple way, natural language, thesaurus discovery, information network, logicinference biologist, structure base feature, word relation, syntactic structure, structure- structure, manual effort, analysis opinion, relation information, topic thesaurus, sentiment analysis opinion, sophisticated representation, word topic, knowledge graph
6a9b1334-5f53-407b-8864-2cff7edbc603	7cd21dbc-b96a-4110-babd-a1fc6160a377	topic model, text mining, text object, text clustering	clustering bias, high probabilities, data mining, topic mining, text objects, world distribution, topic models	large text object, text cluster, application clustering, whole collection, additional feature, overall content, two object, major complaint, search result, text datum, large text, text analysis, exploratory text analysis, exploratory text, text segment, whole collection term, text object example, multiple document, collection term
da74c929-efc1-4b65-9635-684c7ebcab3f	b1fe1481-2d71-4520-af9f-f77f61cee3c5	text mining, generative model, clustering bias, text object, text clustering, similarity function, mutual information	mixture model, text objects, training data	assessor evaluation, text cluster, clustering system, inevitably application, strong cluster, human assessor, text datum, right similarity, clustering result, datum approach, text datum approach, general text mining, interesting clustering, information retrieval, general text, intended application, human assessor evaluation, unsupervised nature, unsupervised general text, interesting clustering structure, multiple perspective, evaluation procedure, text mining technique, possible strong cluster, baseline system, two object, probabilistic model, right generative model, direct evaluation, indirect evaluation, f measure, prabhakar raghavan, optimal number, ideal clustering result, standard cluster, model — similarity, application evaluation procedure, clustering structure, assessor evaluation procedure, right similarity function, test set, generative probabilistic model, ideal clustering, application evaluation, performance measure, content text, gold standard cluster, ideal cluster, mining technique, gold standard, content text datum
39d13817-de51-4195-a33a-985b0b54e64d	96bed99b-34ab-44d8-a237-b370e2fff115	topic mining, text categorization, text object	sentiment analysis, text mining, opinion mining, training examples, data mining, multiple topics, categorization problem, information retrieval, text objects	tweet automatic email, routing author, object topical category, categorization result, semantic category, automatic email, training datum, news literature, text datum, sentiment category, literature categorization, meaningful category, sport business, topical category, predefined category, word association, news literature categorization, text representation, mesh annotation
f1951cf2-4293-450b-8578-4d74c72f9862	bbbad2c5-a171-4077-aa16-5e84937e1a04	language processing, sentiment analysis, opinion mining, opinion holder	text mining	one sentence, hurricane the|governor, opinion opinion, one entity, target eal world, service help voter, eal world, analysis mining, text datum, product search, research data, intelligence market research, market research, text representation, whole article, discourse context, element representation, emotion variation, research gain, help maker, else ’s opinion, entire discourse context, simple context, new policy, people ’s preference, intelligence market, association sentiment, product search optimize, word association sentiment, opinion content, opinion context, different kind, natural language, search optimize system, topic mining, bad hurricane, word association, implicit holder, sentiment analysis mining, association sentiment analysis, policy understand people, natural language processing, opinion target, complex context, gain advantage, business intelligence market, one attribute, opinion opinion holder, business intelligence, surface variation, context simple context, optimize system, author ’s opinion, market research data, research gain advantage, search optimize, target holder, new england, entire discourse
4a54f790-991c-44bb-ab62-713cbef84ad1	1d056124-cea1-42ec-b1f1-5f82a7828df9	sentiment analysis, machine learning, special case, text object, opinion holder, text categorization, sentiment classification	language processing, text mining, related words	feature selection, validation enriche, different — unigram, text representation, analysis feature validation, feature validation enriche, sentiment tag, sentiment tagging, recognition error, error analysis feature, machine learn feature, text categorization method, opinion mining, speech act, word cluster, validation enriche text, error analysis, design affect categorization, complex feature, feature validation, frequent subtree, emotion analysis, task definition, text feature, feature space, tagging — consideration, object output, effective domain, commonly use text, text object output, datum opinion holder, text datum, frequent word, categorization accuracy, effective domain knowledge, knowledge seed, empirical word cluster, feature space machine, feature design, ordinal regression, major goal, sophisticated feature, enriche text, text datum opinion, semantic concept, gram tree, enriche feature space, polarity analysis, beyond polarity, domain knowledge seed, pos tag, analysis feature, opinion content, opinion context, categorization method, word set, nlp enriche, discovery algorithm, feature construction, syntagmatically relate word, frequent word set, likely overfitting, datum opinion, seed feature, knowledge seed feature, entity empirical word, space machine, empirical word, enriche text representation, domain knowledge
