transcriptionid	videoid	phrases_both	phrases_caption	phrases_video
a97a9d5e-48b7-4f4e-9754-4c5b30a31424	a0b51765-30e2-4c12-aa64-02d4206458ca	contextual text, text mining, contextual text mining	data point, sentiment analysis, machine learning, opinion mining, opinion holder, data mining, topic mining	world text datum, text ata, hong cheng, joint mining, text datum, help text, dong xin, mining content, world sensor, world variable subtask, datum — pattern, pattern annotation, prediction text, qiaozhu mei, datum mining loop, big picture, datum help text, real world, unified view, mining knowledge, text datum help, mining text datum, mining — text, semantic annotation, real world sensor, world variable, world text, mining text, jiawei han, real - world, help text mining, datum provide context, perceive express, knowledge discovery, international conference, datum help, real world variable, mining loop, variable subtask, frequent pattern, datum mining, new york, world observe world, help interpret pattern, text datum mining, world real world, datum perceive express
95f92696-1963-4307-83c6-a8370ff03b30	67fd1c6f-384d-40a3-a190-0487f08c5ed8	contextual text mining, opinion mining, contextual text, text mining	topic mining, data mining	one network, two researcher, sudden change, presidential election, word association sentiment, people region, b b, common research, natural language, news datum, stock price, interesting question, research topic, mining research, research interest, time series, word association, www sigir, author topic, www sigir sigmod, common research interest, social network, sigir sigmod, association sentiment
20703c3c-ced6-4410-ace1-139baa46505c	8cf648e7-0a90-4fb3-9577-13f18709c2dd	likelihood function	mixture model, general idea, parameter values	original likelihood, topic model, algorithm part, probabilistic topic model, expectation - maximization, maximization algorithm part, maximization algorithm, probabilistic topic
5bb813bd-6b7d-4f77-8156-21995f5944ad	1cfa3f93-17aa-4b8e-83ef-7fe026cf8c39	mixture model, generative model, text object, text clustering, similarity function	likelihood function, data point, general idea, clustering bias, generative models, objective function, text objects, paradigmatic relation	hierarchical clustering, clustering result, complete - link, similarity strategy, flexible specification, group similarity, two text, average - link, optimal partitioning, probabilistic model, implicit similarity function, model clustering, single - link, model clustering structure, easy way, tentative clustering, group similarity strategy, complex generative model, complex structure, model — similarity, gradually group, individual decision, clustering method, clustering structure, small cluster, implicit similarity, measure approach, generative probabilistic model, model base approach, clustering algorithm, two text object, group decision
7f9f9b1e-4527-4875-b6f7-4dc0d57ab719	867346b9-c5f7-40ba-a928-44b312972ca2	text categorization, machine learning, categorization problem	data point, sentiment analysis, naive bayes, topic model, mixture model, optimization problem, logistic regression, generative model, text object, training examples, generative models, text clustering, logistical regression, objective function, training data, parameter values, overall ratings, topic models	hinrich introduction, classifier part, deep learning, feature selection, domain adaptation, multiple method, machine learning technique, training example, information retrieval, training error, supervised machine learning, supervised learning technique, good separator, soft margin, effective feature, discriminative classifier part, low - quality, learning technique, particular problem, prabhakar raghavan, domain knowledge, linear svm, categorization method, unlabeled datum, text categorization method, supervised machine, specific classifier, effective feature representation, text categorization problem, notation change, margin notation, feature computer, error analysis, margin notation change, training datum, dimension reduction, feature representation, clear winner, supervised learning, good performance, transfer learning, discriminative classifier
4da6283d-6903-4be9-8bfc-ad5d330343c6	e4f3539b-4794-4f15-aa42-628b6261e69a	conditional probability, text object, maximum likelihood, text categorization, logistic regression, similarity function	data point, bayes rule, naive bayes, likelihood function, machine learning, likelihood estimator, optimization problem, special case, total number, general idea, training examples, categorization problem, logistical regression, maximum likelihood estimator, objective function, training data, parameter values, scoring function	close neighbor, neighbor text object, training datum, classifier part, data instance, regression binary response, likelihood estimate, neighbor text, discriminative classifier part, region r, maximum likelihood estimate, binary response variable, label give data, binary response, training set, response variable, two text object, two text, near neighbor, discriminative classifier
51be74e8-eb10-47c2-a768-b688605de1e0	41473d0d-91ad-4e24-b129-9cf24ef12436	syntagmatic relation, conditional entropy, relation discovery	related words, special case, mutual information, syntagmatic relations	complete definition, language processing representation, analysis mining, minimum possible value, sentiment analysis, word w, discrete random variable, association sentiment, random variable, word association sentiment, opinion mining, language processing, candidate word, word association, sentiment analysis mining, association sentiment analysis, syntagmatic relation discovery, potential syntagmatic relation, processing representation, possible value, forwhich word
9e5a0c5f-ff4a-42a6-b37b-f43628632860	ffbde7b0-d07a-4a67-a647-2f77a7c9e6d1	syntagmatic relation, relation discovery, mutual information	conditional entropy, syntagmatic relations	world text datum, syntagmatic relation discovery, co - occurrence, kl - divergence, information use kl, actual joint distribution, information part, text datum, much reduction, world text, joint distribution, world observe world, different probability, entropy reduction, observed joint distribution, mutual information part, real world, presence & absence, word association
44df41bc-04d3-41ca-ac51-dbd22dc98305	aef9082d-d8de-4f6e-a350-17e56a42ceba	conditional entropy, syntagmatic relation, total number, relation discovery, mutual information	observed data, likelihood estimate, maximum likelihood, data mining, paradigmatic relations, maximum likelihood estimate, information retrieval, syntagmatic relations, paradigmatic relation	lexical atom, interdisciplinary conference, text datum, number segment, rio de janeiro, entropy reduction, basic association, statistical natural language, statistical view, joint analysis, lexical relation, information theory, bigdata conference, adjacency graph, actually observe datum, two basic association, big text, mutual information part, de janeiro, random variable, statistical approach, big text datum, three concept, linguistic context, extra datum, pseudo datum, rio de, segment 2 segment, natural language, language processing, pure statistical approach, ieee bigdata conference, word association, information part, two word, association mining, human effort, syntagmatic relation discovery, word association mining, natural language processing, different way, zero count, principled way, ieee bigdata, total number segment, chris manning
aac4e33c-97bb-46c8-a108-3e3e3322a85c	4db83e26-77a9-402f-882f-a5b4b8bd937a	text categorization, categorization problem, text object, objective function	data point, naive bayes, machine learning, conditional probability, optimization problem, training data, logistical regression, text objects	function measure, annotate datum, directly measure, indirectly measure training, training regression, new text object, sufficient domain knowledge, training error, separate category, generative classifier, different category, likely human expert, naive baye, particular category, special vocabulary, soft rule, vector machine, classifier function, function measure error, sufficient domain, error naive baye, domain knowledge, annotate datum set, surface feature, effective rule, support vector, categorization method, datum set, support vector machine, new text, category label, human expert, near neighbor, measure error, training datum, general setup, directly - function, correct category, logistic regression, discriminative classifier
2d0e46c7-df4e-48b3-9550-dac3fec3062d	d08f57f6-d841-4f60-8e19-2fb519f981a1	logistic regression, sentiment analysis, text object	total number, categorization problem, logistical regression, sentiment classification, training data, parameter values, scoring function	rating r, classifier 1 classifier, categorization technique, multiple logistic regression, discrete rating r, ordinal logistic regression, text categorization technique, text document, rating prediction, regular text, level rating, regular text categorization, k-1 regression, positive word, text categorization, independent classifier, high rating, k-1 independent classifier, regression classifier, logistic regression classifier, discrete rating
6382e23f-d54e-4ece-a231-8df819983fb5	2b617d75-996c-4cd0-8dae-c3d419889850	text categorization, categorization problem	machine learning, classification accuracy	ranking problem, hinrich introduction, categorization result, f score, system false negative, f score variation, system mistake, different method, spam email rank, score variation, evaluation part, information retrieval, relative comparison, editing system, different decision, commonly use measure, particular application, false negative, decision error, editing system mistake, categorization evaluation, right person, prabhakar raghavan, spam email, news category, first pool, statistical approach, far editing, micro - averaging, news categorization, email rank, spam filtering, decision discovery, search engine, overall precision, far editing system, different cost, different decision error, f - measure
b1854d1c-3199-4c42-ab7d-f219f70259a3	9dae6cd8-148a-4645-8467-60be00f5eb00	maximum likelihood, sentiment analysis, opinion mining, aspect rating	conditional probability, aspect ratings, topic models, bayesian inference, topic model, parameter values, overall ratings, related words	review document, rating regression aspect, multivariate gaussian, quiet reviewer, latent rating, likelihood estimate, text datum, latent aspect, maximum likelihood estimate, reviewer service, two stage, review text datum, latent aspect rating, text representation, regression aspect, rating regression approach, latent rating regression, rating regression, word sentiment analysis, prior overall rating, three night june, young daughter, likelihood estimate aspect, word sentiment, aspect segment, young daughter room, review text, great location, natural language, language processing, acm kdd, I aspect weight, segmentation rating, segmentation rating regression, topic mining, overall rating, regression approach, spacious room, night june, natural language processing, three night, estimate aspect, bathroom door, estimate aspect rating, rating analysis, quiet reviewer service, daughter room, yue lu, aspect rating analysis, comfy bed
0d005f7e-0c3f-465b-b7fe-08f45355e3de	df7b3e94-20b5-4d62-890f-44b5464af1be	syntagmatic relation, text retrieval, general idea, paradigmatic relation	paradigmatic relations, related words, syntagmatic relations, word associations	tuesday similar context, high co, basic word, expansion grammar, occurrence likely relation, mining word, sunday dog, low individual occurrence, similar context, nlp task, mine word, expansion grammar learning, cat eat turkey, cat eat fish, negative review, pos tagging, dog eat turkey, individual occurrence, basic word relation, grammar learning, co - occurrence, dog eat meat, acronym expansion, likely relation, sunday tuesday, word relation, word association, mine word association, mining word association, association mining, two word, retrieval use word, word association mining, entity recognition, acronym expansion grammar, time two word, complementary relation, saturday eat turkey, automatic construction
2736e0b3-cd3e-4760-b07e-e9aadcc588e2	f991c0fe-81c5-4bcd-a4d5-ac0359b2683f	syntagmatic relation, relation discovery	special case, syntagmatic relations	syntagmatic relation discovery, measure randomness
380a7417-6702-4df8-9818-5aceba7cde2b	860ecb4f-cfee-4d78-b363-116f3ef682a4	topic mining	syntagmatic relation, paradigmatic relations, data mining, syntagmatic relations, paradigmatic relation	main idea, analysis mining, text datum, datum — theme, text document, current research, text representation, sentiment analysis, word sentiment analysis, research datum, presidential election, word sentiment, application require discovery, opinion mining, current research datum, natural language, language processing, sentiment analysis mining, twitter user, natural language processing, formal definition, datum mining, task definition, research datum mining, major topic
b9eb5a35-5bad-4cf5-9d94-b0b0c816c8cf	68fe64aa-5af3-46ef-be84-21ca402e4430	paradigmatic relation, relation discovery	text retrieval, general idea, paradigmatic relations, information retrieval, similarity function, related words	saturday ats, vocabulary size, pseudo document, word vector space, vector space model, word context, d1 count, two context document, one frequent term, wi count, word wi, space model, word vector, vector space, two context, distinct term, frequent term, context document, paradigmatic relation discovery
b75d0d2e-a1b7-4f6a-b699-f81ec4b720c7	fde6d4fd-d6e4-4b10-9bbf-8c88af3d81e7	topic mining	topic coverage, related words, scoring function, word associations	topic incompleteness, n’t capture variation, high score, complicated topic incompleteness, representative term, vocabulary coverage, multiple term, general topic, title word, collection c, word sense ambiguity, complicated topic, basketball star, specific heuristic, word sense, topical term, expressive power, favor title, favor title word, sense ambiguity
3956403f-f159-448a-9514-5dc69f314c5a	b2c565f1-bc24-4299-82ff-3d83cd9ffac6	classification accuracy	total number, categorization problem, information retrieval	cost variation, categorization result, correct decision, precision r, different categorization, true positive, different perspective, evaluation part, relative comparison, different categorization mistake, model discriminative approach, general evaluation methodology, positive false negative, false positive, probabilistic model, system categorization decision, false negative, system categorization, evaluation methodology, positive true negative, equivalently difference, general evaluation, specific application, text categorization, ground truth, document evaluation, true negative, generative probabilistic model, test collection, categorization decision, different cost, categorization mistake
